{
  "graph_id": "G-001-001",
  "benchmark_version": "0.1.0",
  "schema_version": "0.1",
  "nodes": [
    {
      "node_id": "N-001-input",
      "type": "ACTOR",
      "name": "attacker",
      "description": "Unauthenticated public attacker may submit one URL; cannot alter server policy or access the host network directly."
    },
    {
      "node_id": "N-001-control",
      "type": "POLICY",
      "name": "effective security boundary",
      "description": "Effective security control blocks the candidate path."
    },
    {
      "node_id": "N-001-impact",
      "type": "IMPACT",
      "name": "security impact",
      "description": "Expected impact state for FAS-001."
    }
  ],
  "edges": [
    {
      "edge_id": "E-001-1",
      "type": "FLOWS_TO",
      "source": "N-001-input",
      "target": "N-001-control",
      "evidence_ids": [
        "EVD-001-001"
      ]
    },
    {
      "edge_id": "E-001-2",
      "type": "CONTROLS",
      "source": "N-001-control",
      "target": "N-001-impact",
      "evidence_ids": [
        "EVD-001-001"
      ]
    }
  ],
  "paths": [
    {
      "path_id": "P-001-001",
      "node_ids": [
        "N-001-input",
        "N-001-control",
        "N-001-impact"
      ],
      "edge_ids": [
        "E-001-1",
        "E-001-2"
      ],
      "entry_node": "N-001-input",
      "impact_node": "N-001-impact",
      "status": "BLOCKED",
      "evidence_ids": [
        "EVD-001-001"
      ]
    }
  ],
  "entry_points": [
    "N-001-input"
  ],
  "trust_boundaries": [],
  "metadata": {
    "case_id": "FAS-001"
  }
}
