{
  "graph_id": "G-FAS-001",
  "benchmark_version": "0.1.0",
  "schema_version": "0.1",
  "nodes": [
    {
      "node_id": "N-input",
      "type": "INPUT",
      "name": "URL input"
    },
    {
      "node_id": "N-sink",
      "type": "SINK",
      "name": "HTTP sink"
    },
    {
      "node_id": "N-impact",
      "type": "IMPACT",
      "name": "Internal service access"
    }
  ],
  "edges": [
    {
      "edge_id": "E-1",
      "type": "FLOWS_TO",
      "source": "N-input",
      "target": "N-sink",
      "evidence_ids": [
        "EVD-001"
      ]
    },
    {
      "edge_id": "E-2",
      "type": "REACHES",
      "source": "N-sink",
      "target": "N-impact",
      "condition": "Blocked by allowlist",
      "evidence_ids": [
        "EVD-001"
      ]
    }
  ],
  "paths": [
    {
      "path_id": "P-1",
      "node_ids": [
        "N-input",
        "N-sink",
        "N-impact"
      ],
      "edge_ids": [
        "E-1",
        "E-2"
      ],
      "entry_node": "N-input",
      "impact_node": "N-impact",
      "status": "BLOCKED",
      "evidence_ids": [
        "EVD-001"
      ]
    }
  ],
  "entry_points": [
    "N-input"
  ],
  "trust_boundaries": [],
  "metadata": {
    "fixture": true
  }
}